{
  "$schema": "https://json-schema.org/draft/2020-12/schema",
  "title": "DR-0124 contact-publication-winner-read-v1.vectors",
  "type": "object",
  "additionalProperties": false,
  "required": [
    "package",
    "decision",
    "runtimeActivation",
    "owner",
    "positive",
    "hostile",
    "registryOwner",
    "registryPositive",
    "notEvidence"
  ],
  "properties": {
    "package": {
      "const": "CONTACT-PUBLICATION-WINNER-READ-01"
    },
    "decision": {
      "const": "DR-0124"
    },
    "runtimeActivation": {
      "const": false
    },
    "owner": {
      "const": "deep-client-shared/tests/Deep.Client.Shared.Production.Tests/DeepIdV2ContactPathAuthoritySourceTests.PublicationWinnerRead.cs"
    },
    "positive": {
      "const": "Did2PublicationWinnerRead_ExpiredLostReplyColdReopenKeepsOriginalIntent"
    },
    "hostile": {
      "const": [
        "fresh-nonce-substitution",
        "original-response-substitution",
        "lost-read-response",
        "publisher-signature-substitution",
        "unknown-version",
        "reserved",
        "truncated",
        "trailing",
        "hostile-size",
        "wrong-network",
        "wrong-original-request-hash",
        "future-or-expired-current-read",
        "clock-discontinuity",
        "cancelled"
      ]
    },
    "registryOwner": {
      "const": "deep-registry-api/tests/Deep.Registry.Api.Tests/DeepIdV2RouteThresholdIssuerTests.cs"
    },
    "registryPositive": {
      "const": "PublicationWinnerReadPrivateHttpRecoversExpiredPhase5WithoutIssuingAgain"
    },
    "notEvidence": {
      "const": [
        "compile-only is not activation",
        "in-process replica signatures are not live two-store evidence",
        "aggregate journal counts do not identify an owner"
      ]
    }
  }
}
